["Absolute Duo", {"IMAGES": "http://3.bp.blogspot.com/-WT2CZrZtr0Q/VKxuq1d9tUI/AAAAAAAABLM/j0SG1-EiRjQ/s1600/68839l.jpg", "URL_VIDEOS": "http://www.mp4upload.com/embed-q7xxgge1yu1c.html", "DESCRIPTIONS": {"Tipe": " TV", "Jumlah Episode": " 12", "Mulai Tayang": " 4 Januari 2014", "Produksi": " FUNimation EntertainmentL, Half H.P Studio, 8bit", "Genre": " Action, Ecchi, Romance, School, Harem, Supernatural", "Durasi": " 24 min. per episode", "Rating": " R \u2013 17+ (violence & profanity)"}, "SYNOPSIS": "Sinopsis:\nMenceritakan tentang Blaze yaitu senjata yang merupakan manifestasi dari jiwa manusia. Tooru Kokonoe telah memenuhi syarat untuk ini, tetapi untuk beberapa alasan Blaze miliknya bukanlah sebuah senjata, melainkan sebuah tameng. Selain itu, dia bersekolah di sekolah yang mengajarkan tentang kemampuan bertempur, dan berkat sistem dua patner di sekolah, akhirnya dia menjalani hidup menjadi seorang gadis berambut perang yang cantik.\nInformation\nTipe: TV\nJumlah Episode: 12\nMulai Tayang: 4 Januari 2014\nProduksi: FUNimation EntertainmentL, Half H.P Studio, 8bit\nGenre: Action, Ecchi, Romance, School, Harem, Supernatural\nDurasi: 24 min. per episode\nRating: R \u2013 17+ (violence & profanity)\n"}]